index,question,objective
0,"A 67-year-old woman comes to the physician for a follow-up examination. She had a pulmonary embolism and required treatment in the hospital for 3 weeks. She had a retroperitoneal hemorrhage; anticoagulant therapy was temporarily discontinued, and she underwent placement of an inferior vena cava (IVC) filter. She had a hematoma that was resolving on discharge from the hospital 2 weeks ago. Today, she says she has had a persistent sensation of tingling and numbness of her left thigh that she did not report in the hospital because she thought it would go away; the sensation has improved somewhat during the past week. Her only medication is warfarin. Vital signs are within normal limits. Examination of the skin shows no abnormalities. Muscle strength is normal. Sensation to light touch is decreased over a 5 x 5-cm area on the lateral aspect of the left anterior thigh. Which of the following is the most likely cause of this patient's decreased sensation?
A. Cerebral infarction during the hospitalization
B. Complication of the IVC filter placement
C. Compression of the lateral femoral cutaneous nerve
D. Hematoma of the left thigh",Make the answer concise and accurate
