index,question,objective
1,"A 25-year-old gravida 3 para 2 female is admitted to the hospital at 39 weeks' gestation in active labor. She had been having regular contractions every 4 minutes, but is now having only a few intermittent, weak contractions. She has received medication for pain twice in the past 6 hours. Examination shows no reason for obstructed labor. The fetal head is engaged, the membranes are intact, the fetal heart tones are normal, and the cervix is 100% effaced and 7 cm dilated. The most likely diagnosis is
A. Braxton Hicks contractions
B. lower uterine retraction ring
C. hypotonic uterine dysfunction
D. primary dysfunctional labor",Make the answer concise and accurate
